н,ЗАДАЧА,Пояснение,,,,,,,,
1,Автосалоны,"При входе во вкладку АВТОСАЛОНЫ игрок должен видеть 4 автосалона АЛЬФА, БЕТА, ГАММА и ДЕЛЬТА. какие тачки в каких автосалонах появляются видно в этой таблице на листе SHOPS. например, сейчас видны тачки по 43 строку в этих четырех магазинах.",,,,,,,,
2,Внешний вид машинок,"Очень бы хотелось, чтобы вид карточки был такой же, как  в оригинальном игрупере. Это удобно и машинки не срезаются. То есть игрок видит горизонтальную карточку, где справа характеристики, а картинка целиком виднелась бы. Причем, желательно, чтобы цвет карточки был соответственным её классу",,,,,,,,
3,Магазины,исправить косяк в Таврии со сликами,,,,,,,,
,У Ильсурика,"Интерк1, Шатуны1, Коленвал1, ШиныУни1, ШиныГон1",,,,,,,,
,Trash Shopito,"Впуск1, вЫпуск1, диффСБ1, коробка1, поршни1",,,,,,,,
,Колянур,"Фильтры1, РаспрВерх1, Клиренс1, Амортиз1, Лебёдка1",,,,,,,,
,Девяточка,"Тормоза1. Маховик1, Шаровые1, Турб1,Расточка1",,,,,,,,
,Таврия,"Слики1, ШиныОфф1, ТоплСист1, ДиффПТ1, Пруж1, Облегчение1",,,,,,,,
,Батыр,"Компрессор1, РаспрНиз1, РаспрУни1,ШРУС1, Шноркель 1",,,,,,,,
4,Гараж,"в гараже надо сделать вкладку Склад, где будут храниться трофейные детали, кторые можно выставить на аукцион или поставить на свою любую машинку",,,,,,,,
5,Расписание гонок,"при входе в эту вкладку игрок должен видеть, что его ожидает на этой неделе, как на таблице справа. ",Трасса,Мощность,Крутящий момент,Скорость,Разгон,Управляемость,Проходимость,Требование
,,,1960,,,,,,,
,,,вторник 5 мая,,,,,,,
,,,Сельская дорога 1,2,1,1,5,3,2,хэтчбек
,,,Трасса 1,5,2,3,3,3,0,купе
,,,Дрэг 400 метров,1,3,4,8,0,0,Франция
,,,четверг 7 мая,,,,,,,1 авто С класса
,,,Грунтовка 1,2,3,1,4,4,5,
,,,Дорога 1,1,1,1,1,1,1,
,,,Дрифт 1,1,6,0,1,5,0,
,,,суббота 9 мая,,,,,,,
,,,ДРЭГ,2,1,4,3,0,0,
,,,Трек 1,2,2,3,2,3,0,Германия
,,,Кольцо 1,4,2,5,2,1,0,
6,"Сервис "" у Джамшута""","Во вкладке с Магазинами запчастей сделать еще один. Где можно снять установленные детали, в качестве платы за работу Джамшут забирает деталь себе. Эта процедура тоже считается за поездку в магазин, то есть машина, которая была направлена к Джамшуту, в этот раз уже в другие магазины не едет. Детали можно снимать в любом количестве, при этом машина теряет в характеристиках точно так же, как и получала за снятую деталь",,,,,,,,
7,включить в игру градацию призов в зависимости от количества игроков в комнате,смотри третью вкладку НАГРАДЫ в этой таблице,,,,,,,,
8,"РАЗГОН,,сделать сотые секунды","у более быстрых тачек там разгон еле прибавляется , и каждая сотая важно. не 5,5 а 5,52 например",,,,,,,,
9,формула СКОРОСТИ,"rкогда прирост в конкретных фиксированных км/ч, всё оставляем, когда прирост в процентах, используем формулу V=((450-X)*P)*K+X, где V - получаемая в результате покупки детали скорость,  X - скорость ДО покупки детали,  P  - указанный в магазине процент прибавки скорости от детали,  K - коэффициент скорости самой машины",,,,,,,,
10,чат ,не отображаются сообщения после отправки,,игрок 1,игрок 2,игрок 3,игрок 4,игрок 5,,
11,графа ЦЕНА,"она меняется и рядом скаждой (справа наверно) должна быть кнопочка ПРОДАть. Как меняются цены: Цены на купленные авто меняются таким образом: класс редкости 1 - минус 600 каждый этап, пока не достигнет половины начальной цены, класс 2 - минус 300 каждый этап, пока не достигнет половины начальной цены, класс 3 - цена не меняется, класс 4 - плюс 500 после завершения каждого этапа, класс 5 - плюс 1000 после завершения каждого этапа.    ",,"коленвал 4, минимальная цена 3500",3600,3900,5000,4200,,
12,аукцион,"нет вкладки аукцион. Если это сложно, то обойдемся без проблем. Если не сложно, то рядом скаждой (справа наверно) должна быть кнопочка ПРОДАть, после нажатия которой выходила бы менюшка выбора - в БАНК или выстьавить на аукцион?
Если в банк, машина бы уходила по текущей цене (В правилах есть, как меняются цены), если на аукцион, то сам вбиваешь минимальную цену, за которую готов продать, она остается в пользовании игрока и высвечивается у всех игроков во вкладке аукцион, другие игроки вбивают свои предложения, которые можно менять или удалять, пока выставивший игрок не нажмёт ПРОДАТЬ тыкнув на предложение какого-то игрока ,либо можно будет снять с аукциона",типа такого: смотри правее,8000,"форд фокус, минимальная цена 8000",8100,8100,9000,,
13,скрыть саоны и расписания,"пока идет квалификация, игроки не видят ни автосалоны, ни расписания гонок. При окончании квалификации открываются автосалоны. После покупок тачек (В вс в 22:00 , получается, закрываются салоны, открывается расписание)
Это нужно, чтобы игроки не знали, какие тачки надо брать на сезон. Это обязательно нужно",,,,,,,,
14,ПОЛУФИНАЛ и ФИНАЛ,"а вот эти  вообще надо скрыть, они только в конце игры появляются отвлекают и вводят в заблуждение",,,,,,,,
15,вкладка ИГРОКи,чтобы по чужим гаражам посмотреть. это тоже важно. Изучение соперника - это вообще основа победы в игрупере,,,,,,,,
16,кнопка переключения времени,"ввести для создавшего комнату временно кнопку переключения времени на 12 часов что ли. например. щелк один или два раза и сутки прокрутил, установил детальки и дальше играем",,,,,,,,
17,расставление тачек,"время 22:00 наступило, а тюнинг так и остался тюнингом. нельяз расставлять тачки и снова ПЯТНИЦА написано, а счетчик времени просто снова начал отсчитывать",,,,,,,,
18,код комнаты надо вводить только однажды,"когда закрыл браузер, потом снова надо вводить код комнаты, это неудобно. я,например. его не записал, да и вряд ли кто-то запишет) надо только при присоединении к команде в начале, к омнате то есть. а потом она чтоб связана была с его ником что ли..",,,,,,,,